line_no	text	annotation
248	قلم الناسخ وقد اتفقت النسخ فيما رأينا عليه وكأنه تابع عبار التلويح في هذا المقام ولا يرد على	He flags an apparent scribal error repeated across the copies.
249	تلك العبارة بشيء فإن الأصوليين يحصرون كلام السائل في النقض الإجمالي والمناقضة شيئاً 	Under usuli terminology, the questioner's options are classified differently.
250	واحداً على ما تشهد به عباراتهم وذلك اصطلاح آخر وقد مر توضيحه قوله	There naqd ijmali and munaqada may collapse into one category.
251	أما وظيفة المعلل إلخ اعلم أنه لابد أولاً من ثلاثة أمور أحدها تقديم الإشارة إلى البحث وهو	He now turns to the duties of the establisher.
252	ما يتصور البحث على وجه يتمكن من تطبيق الدليل عليه والثاني التلفظ بتقديم الإشارة	First: indicate the issue so the proof can be applied to it.
253	والثالث تحرير البحث أي تعيينه وتشخيصه لأن الكلام من الجانبين إنما يتوجه إلى ما يبحث	Second and third: verbal presentation and precise issue-definition.
254	فيه فلو لم يكن متعيناً ولا [مشخصاً] لم يعلم أن الدليل مظهر لثبوته أو ليس بمظهر له وكذلك	Without specification, neither proof nor counter-proof can be evaluated.
255	بالنسبة إلى دليلالمعارض هذا إذا كان البحث غير بين وأما إذا كان بيناً فلا يحتاج إليه	If the issue is already clear, explicit taḥrīr may be unnecessary.
256	إليه ثم إن السائل إذا سأل فتدبر المعلل إن الاستعجال في الجواب بل يطلب من السائل	The establisher should not rush; he should ask the questioner to specify the objection.
257	المنع وتحقيقه إذ ربما لا يتمكن من التوجيه فالبحث ينقطع أو يظهر الفساد فالمنع	An unclarified objection may collapse or prove defective.
258	يندفع أو يتذكر المعلل الجواب فيتمكن من التعليل عند توجيه السائل المنع التفصيل	Clarification may also help the establisher formulate an answer.
259	فإن المنع على قسمين أحدهما [بطريق] المعلل ويفيد السائل وهو بأن يكون تمام دليله	He distinguishes denials that truly matter from those that do not.
260	 موقوفاً على صحة المقدمة التي منعها السائل [والتي] لا يضر بالمعلل ولا يفيد السائل وذلك	A useful denial targets a premise on which the entire proof depends.
261	قوله أو إبطال سنده إلخ ينبغي أن يعلم أن الكلام على سند المنع لم يجوزه قوم 	He now treats debate over the sanad of a denial.
262	من المحصلين حيث قالوا إن الاشتغال بالكلام على السند والجواب عنه اشتغال	Some scholars reject this as pointless discussion.
263	بما لا يفيد لأن المنع مع السند أخص من مطلق المنع فإن المقيد أخص من	A denial-plus-sanad is narrower than denial as such.
264	غير المقيد ورفع الأخص لا يستلزم رفع الأعم وسمعه آخرون واعترضوا على	So removing the narrower form does not remove the broader denial.
265	أولئك بأنه إذا لم يغد دفع المستند لا يجوز البحث عنه فكيف يمكن الجواب عن المنع	Others reply that if the sanad grounds the denial, it must be answerable.
266	مع بقاء السند فإن السند ملزوم وعلة للمنع ودفع اللازم والمعلول مع بقاء اللازم	One cannot remove the effect while leaving its cause intact.
267	والعلة غير متصور وبان السند إذا كان مساوياً للمنع بمعنى أنه كلما تحقق تحقق	If sanad and denial are coextensive, answering the sanad removes the denial.
268	وبالعكس لا يكون بينهما عموم وخصوص بل يكونان متساويين بحسب التحقق	That would eliminate the general-specific asymmetry.
269	فرفعه يستلزم رفع المنع قوله أي لازماً للمنع فيه إشارة إلى أن مسند المساوي	He stresses that this works only when sanad is necessary to the denial.
270	في غير فهم ما يكون بينه وبين المنع تلازم ويؤيد عما في شرح الآداب المفاضل	This is supported by a statement in another commentary.
271	مسعود الرومي وهو إبطال السند إنما يفيد إذا كان لازماً للمنع [فح] يندفع ما يكاد	Mas'ud al-Rumi likewise requires necessary connection.
272	أن يقال إن قوله بأن يلزم ثبوته أو انتفائه ثبوت المنع إلخ قوله	A possible objection to the formulation is thereby neutralized.
273	وذلك لأن السند إلخ الإشارة إلى جميع ما ذكر وهذا التفسير للسند أولى	He says this broader explanation best captures what sanad means here.
274	من تفسيره بما ذكر لتقوية المنع بزم المانع وإن لم يكن مفيداً في الواقع	He rejects defining sanad merely as rhetorical reinforcement by the objector.
275	لأنه يقتضي أن يكون السند الأعم والسند الغير اللازم للمنع بلا سند	Such a definition would wrongly include non-essential supports.
276	المباين في الواقع أيضاً داخلاً في السند وفرداً من أفراده مع أن كلاً منها	It would admit cases that are not truly fit for sanad-status.
277	لا يصلح للسندية على ما حققوه بزمتهم وكذا من تفسيره وبما يكون	Thus he refines the concept against both too-broad definitions.
278	المنع مبنياً عليه لأنه يصدق على تخلف الحكم فإن منع الدليل بعد تمامه مبني	A further difficulty is that the wording could also apply to failed entailment.
279	Folio 7	Folio marker for the seventh manuscript page.
280	عليه وعلى المعارضة أيضاً لأن منع المدلول مبني عليها فإن خصص المنع بمنع المقدمة فمع	The same broad wording would encompass mu'arada as well.
281	أنه خلاف الظاهر يرد المعارضة التي في المقدمة ومن تفسيره بما يكون مصححاً لورود المنع	Restricting it to premise-denial would still leave problems.
282	لأنه يلزم منه أن لا يكون المنع الغير المقترن بالسند صحيحاً وهو ممنوع فتأملقوله	Another definition would wrongly imply that denial without sanad is invalid.
283	وذلك لأن مدار المنع إلخ ينبغي أن يعلم أن الدوران لغة هو الطواف وقيل الحركة في السكك	He shifts to the concept of dawaran, first lexically.
284	واصطلاحاً عبارة عن ترتب شيء على الشيء الذي له صلوح العلية كترتب الإسهال	Technically, dawaran is concomitance with something apt to be a cause.
285	على شرب السقمونيات والشيء الأول يسمى دائراً والثاني مداراً والمراد بالترتب حصول شيء	Classic medical example: purging follows taking scammony.
286	شيء آخر كحصول النهار عند حصول الشمس والمراد بالحصول العلية	"Occurrence with" is glossed causally rather than merely temporally.
287	الإسهال بشرب السقمونيات ثم إن الدوران ثلاثة أقسام أحدهما أن يكون المدار مداراً للدائر	He divides dawaran into three forms.
288	وجود الإعدام كما في المثال المذكور فإنه إذا وجد السقمونيا وجد الإسهال وإذا عدم فلا يلزم	First: presence-based concomitance without necessary absence.
289	عدم الإسهال لجواز أن يحصل بدواء آخر وثانيها أن يكون مداراً للدائر عدماً لا وجوداً	Purging may arise from another drug, so absence does not track.
290	 كالحياة للعلم فإنها إذا لم توجد لم يوجد العلم أما إذا وجدت فلا يلزم وجود العلم وثالثها أن يكون 	Second: absence-based concomitance, as life is necessary but not sufficient for knowledge.
291	مداراً له وجوداً وعدماً على معنى أنه كلما وجد وجد وكلما انتفى انتفى كالزنا الصادر من	Third: full bidirectional concomitance.
292	المحصن لوجوب الرجم عليه فإنه كلما وجد وجب الرجم عليه وكلما لم يوجد لم يجب ويسمى هذا التقسيم	Example: zina by a muḥṣan and the hadd of stoning.
293	دوراناً كلياً والأولان دوراً جزئياً إذا تقرر ما تلونا فاعلم أن البحث إنما يقع فيما فيه حكم	Full concomitance is called universal; the first two are partial.
294	بنفي أو إثبات وإن المنع في عرفهم مقول بالاشتراك على معنيين أحدهما طلب الدليل على مقدمة	He returns to denial and says the term is shared between two senses.
295	الدليل وثانيهما السؤال والداخل في مقابلة الدليل سواء كان بطريق المطالبة أو الإبطال والأول	First sense: asking proof for a premise; second: opposition to proof generally.
296	أخص من الثاني وكلاهما متعلقان بالدليل على دعوى ثبوت الحكم ثم إن الناقل من حيث إنه	Both relate to proof for an asserted judgment, but one is narrower.
297	ناقل أن يذكر فيما نقله دليل فظاهر أنه لا يتوجه عليه شيء من النوع الثالثة بل يطلب منه تصحيح	A mere transmitter of someone else's view is not targeted like an actual proponent.
298	النقل إن لم يكن معلوماً لا غير وإن ذكر فيه دليل فإنما هو على طريق الحكاية من المنقول عنه كتاباً	If he cites an argument, it may still be only a report.
299	كان أو غيره فلا يتوجه عليه شيء منها أيضاً نعم إذا التزم صحته أو أقام دليلاً برأسه	Only if he endorses it or produces his own proof does liability attach.
300	على ما نقله صار مستند لاح فيتوجه عليه ما يتوجه عليه كذا أفيد قوله ألا ترى أن المنع	Then he assumes the role of actual arguer and objections apply.
301	لا يتوجه على الحدود إلخ قد عرفت أن البحث إنما يقع فيما فيه حكم إما بنفي أو إثبات وهو	He now distinguishes definitions from propositional issues.
302	إلى التعريفات والمسائل ولكل منهما طرق مخصوصة في البيان والمطالبة أما المسائل فقد بينت	Both definitions and questions have their own procedures.
303	قبل وأما التعريفات فقد علم في المنطق أنها أربعة أقسام حدان ورسمان قوله	Definitions are recalled from logic as genus-differentia and descriptive types.
304	فيمكن توجه المنع إليه إلخ الظاهر أن مراده بالمنع هنا وفيما سبق واحد وهو ما يشمل	He clarifies that "denial" here still covers its several objection-forms.
305	المناقضة والنقض والمعارضة وحاصله أنه لا يتوجه منها على الحدود شيء إلا إذا	Definitions are not objected to in the same way unless they involve a claim.
306	حكم المعرف بالحد على المحدود أو اعتبر الخصم ذلك لأن المعرف متى قال هذا هو كذا	If a definer says "this is such-and-such," he effectively advances a proposition.
307	وكذا على أنه تعريف للشيء فهو دعوى من الدعاوى وجاز أن يكون الأمر بخلافه فجاز أن	That propositional aspect opens the door to denial, refutation, or counter-proof.
308	يمنع أو ينقض أو يعارض إذا قدر الدليل على تلك الدعوى لا سميا إذا ادعى أنه حد تام	This is especially true if he claims the definition is complete or exact.
309	مثلاً فإنه ح يشتمل على دعوى الجنس والفصل القريبين فيتوجه عليه المنع ويجب عليه	A full hadd implies claims about genus and differentia that require defense.
310	بيان ذلك أو ادعى أن هذا التعريف عند قوم وبعينهم فإنه مشتمل على دعوى الاصطلاح	If he attributes a definition to a school, he also asserts a technical usage.
311	منهم فيتوجه المنع ويجب عليه تصحيح النقل عنهم هذاقوله أما أن يعجز المعلل	Then he must verify the transmission; next comes debate outcomes.
312	إلخ هذا التقسيم أولى مما ذهب إليه الإمام السمرقندي وهو أن المعلل إما أن ينقطع	This classification of outcomes is said to be better than Samarqandi's.
313	بالمنع أو المعارضة أو لا ينقطع بل يستدل على إثبات كل مقدمة منعها السائل بدليل آخر أو	Samarqandi's model is summarized as either interruption or continued proof.
314	تنبيه فإن انقطع فقد حصل الإفهام للمعلل وإن لم ينقطع فلا يخلو من أن ينتهي في تلك	If the establisher stops, that is ifham; otherwise the process continues.
315	المناظرة إلى أمر ضروري القبول أولاً فإن كان الأول يلزم إلزام السائل وإن كان الثاني يلزم	Either the debate reaches what must be accepted, or further consequences follow.
316	المعلل لأنه إما أن يعجز من إقامة الدليل على مقدمة منعها السائل أو لا يعجز بل تتسلسل	If not, the establisher either fails or enters an infinite regress of proofs.
317	أدلته إلى غير النهاية والثاني محال فتعين الأول فيلزم الإقحام على تقرير عدم استحالة	The infinite regress option is declared impossible, forcing ifham.
318	التسلسل يلزم ذلك أيضاً لأنه لا يتمكن من إثباته أمور لا نهاية لها في مدة عمره فضلاً	Even if one allowed regress, no human could traverse infinitely many proofs.
319	عن إثباتها في مجلس واحد أو مجالس معدودة لامتناع إحاطة الذهن بما لا نهاية	Nor can the mind encompass the infinite within limited debate sessions.
320	له إذ لو أحاط به لكان متناهياً وإنما كان ما ذكره المصنف أولى لأنه قد اعترض على	The impossibility is reinforced by the contradiction of a grasped infinite.
321	هذا التقسيم بأن العجز عن الاستدلال داخل في الانقطاع بالمنع أو المعارضة	He then records an objection to Samarqandi's division.
322	وقد جعل قسيماً له هنا وإن أجيب عنه بمنع دخوله فيه بناء على أن العجز أعم من الانقطاع	Failure to prove seems already included within interruption.
323	بهما والعام لا يكون مندرجاً تحت الخاص بل الأمر بالعكس فيناقش فيه بأنه يلزم من	The reply invokes a general-specific distinction, but he probes that too.
324	كون العجز أعم من الانقطاع ومن دخول الانقطاع تحته أن يكون العام قسيماً للخاص	If interruption falls under broader failure, the division remains conceptually awkward.
325	أيضاً فيلزم ذلك المجزوم سواء جعل العجز أعم من الانقطاع أو جعل الانقطاع	The structural problem persists whichever category is made broader.
326	Folio 8	Folio marker for the eighth manuscript page.
327	أعم من العجز وأما تقسيم المصنف فسالم من الاعتراض بل ما لا يخفى قوله ولا بأس بالاستفسار	The author's own division avoids that objection; he now treats istifsar.
328	هو استفعال من المفسر وهو لغة طلب الكشف والإظهار ومنه التفسيرقوله وبعض	Istifsar is explained lexically as a request for clarification or disclosure.
329	المناظرين عد ذلك إلخ الظاهر أن مراده بذلك البعض الإمام ابن الحاجب فإنه عد هذا النوع من الاعتراضات	Some counted it among objections; Ibn al-Hajib is likely intended.
330	الواردة على قياس العلة في مختصر الأصول بل بدأها به لأنه المتقدمة على كل اعتراض فإن	Ibn al-Hajib even placed it first among objections to causal analogy.
331	السائل إذا لم يعرف مدلول اللفظ استحال عليه توجيه المنع قوله لكنه يكون سؤالاً	If the questioner does not understand the term, he cannot yet object.
332	بالمعنى اللغوي من سألته الشيء فهو بمعنى سائل المعروف لا من سألته عن الشيء وفيه	It is a "question" only in the ordinary sense, not yet a technical objection.
333	إشارة إلى أن عد ذلك من الاعتراضات ليس على ما ينبغي بل هو طليعة جيش الاعتراضات	Therefore istifsar is the prelude to objections, not one of them strictly.
334	لا منها فإن الاعتراض عبارة عن خدش كلام المستدل والاستفسار ليس فيه خدش	An objection attacks the proof; clarification does not yet attack it.
335	بل تعرف المراد وتبين للمطلوب ليتوجه ح السؤال قوله وهذا مما يجوز	Instead it seeks understanding so that a proper question may follow.
336	إذا كان في اللفظ إجمال أو غرابة إلخ أما الأول فكلفظ القرء مثلاً وأما الثاني فكخلط	It is permitted when wording is ambiguous or technically unfamiliar.
337	اصطلاح كان يستعمل في القياسات الفقهية لفظ الدور أو التس أو الهيولي أو المادة	He lists difficult technical vocabulary from logic and philosophy as examples.
338	أو المبدأ أو الغاية وما أشبه ذلك من اصطلاح المتكلمين هذا إذا لم يعلم من حال خصمه	Such requests are justified when the opponent likely does not know the terms.
339	مفرقة ذلك وأما إذا علم فلا غواية ويلزم السائل بيان كون ذلك اللفظ مجملاً أو غريباً حتى	If the opponent clearly knows them, frivolous requests are blameworthy.
340	يحتاج المعلل إلى التفسير لأن الأصل عدم الإجمال وعدم الغرابة وللمعلل منع ذلك	The questioner must show real ambiguity or strangeness; default presumption is clarity.
341	لأن شرط الدلالة على المراد عدم إجماله أو غرابة وبيان شرط الدليل على المستدل ثم	The establisher may resist the request by affirming that his wording is plain.
342	إن جواب الاستفسار يكون بضد ما ادعى السائل بأن يقول المستدل هذا ظاهر	The answer is to deny obscurity and explain the term's obviousness.
343	في مقصودي ويبين ذلك إما بنقل من أهل اللغة أو بالنقل من أهل العرف العام	Clarification may be supported by lexical authority or common usage.
344	أو الخاص انتهى هذا ما أوردنا تعليقه على شرح رسالة مولانا العلامة المحقق	Technical custom can also justify the wording; the gloss now closes.
345	شهاب الملة والدين أحمد الطاش كبري رحمه الله وصلى الله على سيدنا ومولانا محمد وآله 	Closing prayer for Taşköprüzade and blessings on the Prophet and his family.
