line_no	text	annotation
120	المنع إلخ إن كان مراده بالنظر في قوله من قبيل النظر فيها بمعنى الفكر فهو صحيح	If naẓar means thought, the prior answer works.
121	لكنه ليس بمرضيّ ضده وإن مراد النظر بمعنى التوجه كما هو تفسيره فلا معنى لإقحام	If naẓar means mere orientation, the wording becomes awkward.
122	لفظ القبيل فتأمل.قوله وسيجيء تفصيلها ملخص التفصيل الآتي أن 	He moves to the promised classification of opposition.
123	المعارضة على قسمين معارضة في الدليل ومعارضة في المقدمة وإن الأولى تنقسم	Mu'arada is divided into opposition to the proof and opposition to a premise.
124	إلى القلب والمثل والغير وقد جعل المقسم ههنا مطلق المعارضة فتدبرها قوله       	The first type is further divided into qalb, mithl, and ghayr.
125	لأنه إما أن يمنع مقدمة الدليل اعلم أن المقدمة تطلق تارة على ما يتوقف عليه	He pauses over the term muqaddima, noting its several meanings.
126	الأبحاث الآتية وتارية على قضية جعلت جزء قياس وتارة على ما يتوقف عليه 	A premise may be part of a syllogism or a condition of valid proof.
127	صحة الدليل والمراد بالمقدمة هنا أحد المعنيين والمعنى الأول أعم من الآخرين	Here one of these technical senses is intended, with one broader than the rest.
128	لأن كل ما جعل جزء دليل أو يتوقف عليه صحة الدليل يتوقف عليه الأبحاث الآتية	Anything that is part of proof or required for proof conditions later inquiry.
129	من غير عكس كما يجاب الصغرى وكلية الكبرى فإن صحة الدليل بل هنا خارجان	The relation is one-way, as shown through syllogistic examples.
130	عنه هذا ثم الدليل هنا عبارة عن المركب من قضيتين للتأدي إلى مجهول نظري	He defines proof here as a compound of two propositions yielding theoretical knowledge.
131	وهذا أولى من تعريفه بما يلزم من العلم به العلم بشيء آخر على ما هو المشهور لانتقاضه 	He prefers this over the broad standard definition of dalil.
132	طرداً بالمعرفات بالنسبة على معرفاتها والملزومات بالنسبة إلى لوازمها البينة و	The standard definition overgenerates, including definitions and obvious concomitants.
133	عكساً بالأدلة الغير البينة الإنتاج وبالدليل الفاسدة الصورة سواء كان على 	It also undergenerates by excluding some inferential forms and malformed proofs.
134	الصحة أو على قصد التغليظ كقولنا الإنسان حيوان والحيوان جنس لإثبات الإنسان 	He gives a faulty argument example to show the problem.
135	جنس وفساد الصورة فيه باعتبار أن الكبرى ليست كلية بخلاف التعريف الأول	The form fails because the major premise is not universal.
136	على ما قيل فتأمل قوله وإنما قدم منع المقدمة إلخ الجواب لإيراد مشهور	He turns to why denial of a premise is discussed before other moves.
137	 وهوان ترتب المنوع على ما ذكره الإمام الرازي في المحاكمات هو أن النقيض	Razi's ordering gives priority differently, raising an objection.
138	مقدم على المناقضة وهي على المعارضة وهذا ما يقتضيه طبع البحث فإن الدليل 	Natural procedure seems to prioritize refutation of the proof itself.
139	Folio 4	Folio marker for the fourth manuscript page.
140	موصل قريب إلى المطلوب ومقدماته موصلات بعيدة والنظر في الموصل	The full proof is a nearer route to the conclusion than its separate premises.
141	القريب أقرب في النظر أهل المناظرة إلى ما هو المقصود أعني رد ما يدعيه الخصم وأن	So debating practice might seem to start with the proof, not the parts.
142	النقض يدل على فساد الدليل صريحاً بخلاف المناقضة فإنها تدل على خفائه وأما المعارضة	Naqd explicitly shows the proof's failure; munaqada and mu'arada differ in force.
143	فهي قدح في الدليل ضمناً فلا عبرة بها فلو قدم المصنف النقض على المناقضة لوافق	Opposition is more indirect, so another ordering might appear preferable.
144	الوضع الطبع وتقرير الجواب أن طبع البحث وإن اقتضى تقديم النقض ولكن تقدم متعلق	Response: although naqd seems prior, its object is posterior to the premises.
145	 المناقضة وهو مقدمات الدليل على متعلق النقض الذي هو مجموع	Munaqada concerns premises, which are ontologically prior to the whole proof.
146	الدليل يقتضي تقديم المناقضة لتعلقه بالجزء الدليل ولا شك أن الجزء متقدم	Hence premise-level denial can legitimately precede proof-level refutation.
147	على الكل طبعاً فكذا ما يتعلق به على قياس ما تقرر في علم المنطق من تقديم	This is likened to logic's priority of what leads to conception before assent.
148	الموصل إلى التصور على الموصل إلى التصديق هذا ويمكن أن يقال	A secondary explanatory route is then proposed.
149	يجوز أن يكون عدول المصنف مما ذكره الإمام الرازي لنكتة وهي رعاية التناسب	The author may have shifted order to preserve a certain conceptual symmetry.
150	بين النقض والمعارضة في كون كل واحد منهما استدلالاً وراجعاً إلى منع	Naqd and mu'arada both involve argumentative resistance rather than simple demand.
151	مقدمة غير معينة وفي هذا المقام أبحاث نفيسة تطلب من الحاشية الفتحية	He refers readers to another gloss for more detailed discussion.
152	قوله أي الذي هو شاهد المنع المشهور فيما بينهم أن المنع	He now defines the "witness" or supporting sign associated with denial.
153	في هذا المقام إنما يقارن الند فقط وأما الشاهد فإن اعتبر مفهومه	Common usage links a certain companion notion specifically to one objection type.
154	فقط وهو ما يدل على فساد الدليل من غير اعتبار قيد الحيثية فقد يصدق	If "witness" is taken broadly, it may overlap with sanad.
155	على السند بهذا الاعتبار فيقارن المنع بطريق المطالبة وإن اعتبر مفهوم	If taken with a stricter qualification, the overlap disappears.
156	مع ذلك القيد فلا يصدق عليه ولا يقارن المنع المذكور وإنما يقارن	He distinguishes broad versus narrow readings of "witness."
157	المنع بطريق الإبطال فإن السند وإن كان يصدق عليه أنه مشاهد لكن	Sanad may show failure, but not always in the same technical sense.
158	لا يصدق عليه من حيث أنه شاهد فعلى التقدير الأول الشاهد أعم من السند	On one reading, witness is broader than sanad.
159	وعلى الثاني مباين له بالاعتبار وقد يطلق الشاهد على ما يدل على فساد	On another reading, the two are distinct.
160	الدليل من حيث إنه ذلك وعلى هذا لا يصدق على السند أصلاً بل يكون	If defined by proof-failure as such, sanad is excluded altogether.
161	مبايناً له لذات والاعتبار جميعاً إذا تحققت هذا علمت ما في تفسير	This shows the defect in equating sanad with witness.
162	السند بالشاهد من الخلل اللهم إلا أن يقال السند مرادف الشهادة عند الأصوليين وفيه	He notes an attempted usuli defense of the equivalence.
163	أن ذلك مبني على جعل النقض والمناقضة شيئاً واحد وحصر الكلام السائل في المناقضة والمعارضة	But that depends on a different classification collapsing naqd and munaqada.
164	وأنه اصطلاح آخر وتوضيحه أن المناقضة عندهم عبارة عن النقض ومرجعها إلى الممانعة	This is presented as an alternative terminology, not the current one.
165	لأنها امتناع من تسليم بعض المقدمات من غير تعيين وتخلف الحكم عندهم بمنزلة السند	In that system, failed entailment functions like the supporting sanad.
166	فتأمل قوله ومنها نوع إلخ لا مرية في أن المناقضة منع بطريق المطالبة فقط ففي	Returning to the present system, he questions a subtype's placement under munaqada.
167	اندراج هذا النوع تحت المناقضة خفاء فإنه في الحقيقة عبارة عن دعوى فساد المقدمة	The subtype is really a claim that a premise is defective.
168	بناء على الاشتباه فالأحرى أن يجعل من أنواع النقض الإجمالية فتأمل قوله 	It might better be counted under broad refutation instead.
169	إنما يرد على مقدمة مبنية على الفاظ اعلم أن السبب العالم في تحقيق الغلط في الدليل	He introduces fallacy arising from verbal ambiguity in a premise.
170	هو عدم التمييز بين الشيء وما يشبهه لأنه لو لم يشتبه شيء بما شابهه لما أمكن	Error stems from confusing a thing with what resembles it.
171	التلفظ ثم الغلط إما أن يكون بسبب المادة أو بسبب الصورة أو بسببهما	Fallacy may be material, formal, or both.
172	جميعاً وأسباب الغلط البسيط تنحصر في اثني عشر قسماً ستة منها في الألفاظ و	Simple errors are divided into twelve types, six verbal and six semantic.
173	ستة منها في المعاني وقد يتألف منها أقسام أخرى يعني معرفة بساقطها عنها	Further composite classes arise from combining those basic types.
174	وإن أردت الوقوف على معرفة هذه الأقسام وأمثلتها وحلها فارجع إلى شرح القسطاس	He refers readers to Samarqandi's Sharh al-Qistas for details.
175	 للإمام السمرقندي قوله أي إقامة الدليل على خلاف ما أقامه على	He resumes the definition of mu'arada as proving the contrary.
176	رأي الإمام المحقق من أهل النظر وإما على رأي صاحب المقدمة فالغصب	Under another view, acting too early in this way counts as usurpation.
177	قوله فهو غصب إلخ قيل فما سمي غصباً لأن السائل إذا كان في منع	He explains why the move is called "ghasb" in debate.
178	المقدمة لا يكون معارضاً بل يكون مناقضاً فالمعارضة منصب	The questioner seizes the role of the objector-prover improperly.
179	الغير وقد عصب السائل ذلك المنصب وقيل لأن التعليل قبل إثبات	One explanation is role usurpation; another concerns procedural right.
180	المقدمة الممنوعة حق المعلل ولا حق للسائل إلا المنع المجرد	The establisher has priority to prove his premise before counter-proof appears.
181	أو منع سند المطالبة قوله لاستلزامه الخبط إلخ حاصله	The questioner's right is limited to denial or challenging the basis of demand.
182	أن الغصب لا يسمع ولا يلتفت إليه قوله خلاف البعض	Therefore ghasb is generally inadmissible.
183	إلخ نقل من الإمام ركن الدين العميدي أنه كان يسمع الغصب	But Rukn al-Din al-Amidi reportedly allowed hearing it.
184	ويقول إن منعه وعدم سماعه لا يجدي نفعاً فإن السائل	Al-Amidi argues that exclusion is often practically useless.
185	Folio 5	Folio marker for the fifth manuscript page.
186	قد يكون ذهنياً فيخرج ما قاله عن صورة الغصب بأدنى تفسير مثلاً في المثال المذكور	The questioner can often rephrase the move to make it admissible.
187	آنفاً يقول لا نسلم أن الحلي مراد هو غير مراداً لثبت الحكم فيه لكنه غير ثابت وذلك لقوله عليه الصلاة	Illustrative case: dispute over whether "ornament" is intended in a legal proof.
188	والسلام لا زكاة في الحلي فإن قال المعلل هذا غصب وهوغير مسموع فيقول السائل هكذا الحلي	A hadith about no alms on ornaments supplies the counterexample.
189	غير مراد إذ لو كان مراد منه لكان مع جميع لوازم الإرادة كالحكم في صورة النزاع والحرج 	The questioner reformulates the objection through entailments of intended meaning.
190	بعدم الأداء لكن جميع اللوازم منتفية لقوله عليه السلام لا زكاة في الحلي فح يكون قياساً 	Because the entailments fail, the objection becomes a structured conditional proof.
191	استثنائياً واجب السمع وإن كان كذلك يكون الغصب مسموعاً إذ سماعه والالتفات	If recast as a valid hypothetical syllogism, it must be heard.
192	إليه يدفعه أولاً أولى ومنعه لا يجدي نفعاً فبالعناية يستحق الجواب كما علمت وقد أورد	Thus answering it directly may be better than formally excluding it.
193	على الإمام ركن الدين البحث من وجهين أحدهما أن ما هو باطل فالأصل أن لا يجاب	He then records two objections against al-Amidi's permissive view.
194	عنه وما لا يتوقع إلا من البعض في بعض الأحيان لا يترك الأصل لأجله والثاني 	First objection: one should not abandon the norm for occasional cases.
195	أن الجواب عن الغصب لا يخلو إما أن يكون جواباً عن نفس الغصب وهو باطل	Second objection begins: either the answer targets the invalid move itself or not.
196	لأن الغصب باطل بالاتفاق والباطل لا يستحق الجواب أصلاً أو يكون جواباً عما يقال 	If it targets ghasb itself, that is improper because the move is void by consensus.
197	بعد المنع ولا يجدي نفعاً أيضاً لأنه لا يكون جواباً عن الغصب فتأمل قوله	If it answers only a later reformulation, that still does not justify hearing the ghasb.
198	وذلك الشاهد على نوعين إلخ ظاهر كلام المحقق مولانا عضد الملة والدين في الرسالة	He turns back to "witness" and notes how 'Adud al-Din presents it.
199	تخصيص الشاهد بالتخلف وحصره فيه وقد أورد عليه أن النقض لا يختص بالتخلف المذكور	'Adud seems to restrict witness to failed entailment, but this is challenged.
200	بل هو عبارة عن منع الدليل بأن يقال إن هذا الدليل غير صحيح إما لتخلف الحكم عنه أو لاستلز	Naqd is broader than one kind of failure.
201	ام فساد آخر على أي وجه كان من الخصوصيات وأجيب عنه بأن هذا إنما يرد ما لو حمل التخلف	The reply depends on reading "takhalluf" broadly rather than narrowly.
202	على تخلف الحكم عن الدليل كما هو المتبادر وأما إذا حمل على ما هو أعم من تخلف المذكور من	If broad enough, it covers other inferential breakdowns too.
203	الدليل ولخلف اللازم من الملزوم فلا ورود له لأنه إن استلزم الدليل فساداً كان	A proof implying absurdity necessarily lacks a valid entailment relation.
204	لازمه متخلفاً عنه قطعاً ضرورة أن ذلك الفساد اللازم غير متحقق في الواقع علم أنه	The unwanted consequence is absent in reality, so the proof fails.
205	على تقدير حمل التخلف على المعنى الأول إنما يتوجه ذلك الإيراد إن أريد بالحكم الحكم	On the narrow reading, the objection returns depending on what "judgment" means.
206	الذي في الدعوى أو غير فلا قوله واعلم أن النقض قد يكون إلخ أي بأن	He next distinguishes kinds of naqd by structural variation.
207	لا يتفاوت الدليل في الموضعين إلا باعتبار المحكوم عليه في الأقيسة آلاقبئرا نیت	One form keeps the proof the same except for the subject term.
208	أعني موضوع الصغرى في الشكل الأول وباعتبار الجزء المتكرر بعينه إما نفياً أو إثباتاً	This is explained through the subject of the minor premise or repeated conditional part.
209	في لائقة الاستثنائية كما إذا كان المدعى أن كلام الله تعالى أزلي فالمحكوم عليه	Example: the claim that God's speech is eternal.
210	هو الكلام وقياسه أنه أسنده إلى ذاته حقيقة وكلما كان كذلك فهو صفة أزلية	The proof is that what is truly attributed to God's essence is eternal.
211	فينقض بأن يجري هذا الدليل بعينه في الخلق بأن يقال الخلق أزلي فالحكم عليه	The same form is then run on "creation" to expose a problem.
212	هنا الخلق وقياسه أنه أسند على ذاته وكلما كان كذلك فهو أزلي فهذا الدليل بعينه الدليل	That yields the absurd conclusion that creation is eternal.
213	الأول لأن التفاوت بينهما باعتبار المحكوم عليه ليس إلا فإنه في الأول الكلام وفي الثاني	The two arguments differ only in the subject term.
214	الخلق قوله وقد يكون بأجزاء ملخص الدليل إلخ كان يقال في المثال المذكور الكلام مسند	Another kind of naqd uses summarized parts of the proof.
215	إليه يقال بطريق الحقيقة لأنه ورد في القرآن ذلك وكلام الله موسى تكليماً فيقعد الناقض الخلق 	Qur'anic wording is cited to support the original attribution.
216	مسند إليه بطريق الحقيقة أيضاً لأنه ورد في القرآن ذلك إنا خلقنا الإنسان في أحسن تقويم	A parallel Qur'anic attribution of creation produces the counter-instance.
217	قوله وقد ينقض الدليل الدليل اشتهر فيما بين الجدليين أن الكسر عبارة	He turns to "kasr," a well-known dialectical technique.
218	عن إسقاط وصف من أوصاف العلة المركبة وإخراجه من الاعتبار بيان الدلالة أنه لا أثر له وقد	Kasr removes one element of a compound cause as irrelevant.
219	ذكر له صورتان إخديهما أن يبدل ذلك الوصف الخاص الذي بين أنه لغوي بوصف أعم منه	First form: replace a specific feature with a broader one.
220	ثم إن السائل ينقضه على المستدل كأن يقول شافعي في إثبات صلاة الخوف صلاة	Legal example begins concerning fear-prayer.
221	يجب قضاؤها فيجب أداؤها كصلاة الأمن فيقول المعترض خصوص كونها صلاة	The Shafi'i argument treats fear-prayer as something that must be performed because it must be made up.
222	ملغى لا أثر له لأن الحج والصوم كذلك فلم يبق إلا الوصف العام وهو كونها عبارة فينقض	The objector says the feature "being a prayer" is irrelevant since hajj and fasting also fit.
223	عليه بصوم الحائض فإنه عبادة يجب قضاؤها ولا يجب أداؤها بل يحرم والصورة الثانية	The fasting of a menstruating woman serves as counterexample.
224	أن لا يبدل ذلك الوصف فلا يبقى في مثالنا إلا قول وجب قضاؤها فيجب أداؤها	Second form: omit the specific feature without replacement.
225	فيقال ليس كلما وجب قضاؤه وجب أداؤه بدليل صوم الحائض فقد أعرض ذلك	The general rule is then directly refuted by the same counterexample.
226	الوصف بالكلية وذكر صورة النقض هذا نقل من إمام أهل الجدل أبو إسحاق	The specific descriptor is dropped entirely; the view is traced to Abu Ishaq al-Shirazi.
227	الشيرازي أنه قال في الملخص ما نصه وهو أي هذا النوع من النقض سؤال مليح والاشتغال به	Al-Shirazi praises this as an elegant objection.
228	ينتهي إلى بيان الفقه وتصحيح العلة وقد اتفق أكثر أهل العلم على صحته أو فساده	It helps clarify fiqh and correct the causal rationale, though there was disagreement.
229	ويسمونه بالنقض من طريق المعنى والإلزام من طريق الفقه وأنكر ذلك طائفة من	It is called semantic naqd or juridical ilzam.
230	الخراسانيين قالوا إن العلة هي مجموع الصفات وتخلف الحكم من بعضها لا يوجب	Some Khurasanis reject it because the cause is the total set of attributes.
231	بالنقض وأما تسميته بالنقض المكسور فليست بمعروفة عند أهل الجدل	He notes that the label "broken naqd" is not standard among dialecticians.
232	Folio 6	Folio marker for the sixth manuscript page.
233	غير أن الآمدي انفرد بهذه التسمية والمصنف تابعه قوله واعلم أن المعارضة إلخ لا	Al-Amidi uniquely used that label, and the author followed him.
234	يذهب عليك ما بين هذا وبين قوله في المتن ومنع المدلول إلخ من التدافع فإن هذا التعريف	He notes tension between this and the matn's earlier definition of mu'arada.
235	يقتضي تعلق المعارضة بالدليل بلا مرتبة على أنه لو ذكر التعريف المشهور أعني إقامة الدليل	This wording seems to attach opposition directly to the proof.
236	إلخ لكان أسلم وإن نوقش فيه أيضاً فتأمل قوله بعد إثبات المعلل إلخ قيد به لأن	The more common definition would be safer, though not beyond criticism.
237	السائل إذا أقام الدليل على نفي شيء من المقدمات قبل إثبات المعلل تلك المقدمة يكون غصباً	The "after the establisher proves" condition prevents premature ghasb.
238	لأن المعلل ما دام معللاً يكون التعليل حقه ليعلم حقيقة الدليل أو بطلانه وليس للسائل	The establisher has the procedural right to present his proof first.
239	إلا مطالبة ذلك فلو تعرضالسائل لمنع المقدمة قبل الإثبات يكون غصباً وقد مر تفصيله	The questioner's early counter-proof counts as usurpation, as previously explained.
240	قوله والمعارضة في الحكم إلخ تخصيص البيان بهذا القسم من المعارضة ليس على ما	He questions why the exposition isolates only opposition in the judgment.
241	يبتنى فقد ذكر المحقق السعد في التلويح ما نصه والمعارضة في المقدمة إن كانت بجعل علة	Sa'd al-Din's Tawdih/Talwih is cited for a fuller classification.
242	المستدل معلولاً والمعلول علة فمعارضة فيها معنى المناقضة وإلا فمعارضة خالصة وهي قد تكون	Premise-level opposition may resemble denial if cause and effect are reversed.
243	لنفي عليّة ما أثبت المستدل عليته وقد تكون لإثبات علية علة أخرى ما قصره وأما	Or it may negate the asserted cause or posit an alternative cause.
244	متعديه التي مجمع عليه أو مختلف فيه هذه عبارة إلا أن يقال مراده أن المنقسم إلى الأنواع	The transmitted wording is somewhat rough; he suggests a charitable interpretation.
245	الثلاثة هو هذا القسم وقد علمت ما فيه مما مر فكن على ما ذكر منه انتهى قوله	Perhaps only one subsection was meant to divide into three types.
246	فمن حيث إبطال دليل المعلل إلخ لا يخفى أن هذا غير مختص بالقلب بل المعارضة مطلقاً	The feature of invalidating the establisher's proof is not unique to qalb.
247	منع بطريق الإبطال كما هو المشهورقوله وأما المناقضة إلخ فيه سهو ظاهر لعلة من	All mu'arada is, in a common sense, denial by refutation.
